{
  "index": 12,
  "layout": "timeline",
  "canvas": {
    "width_px": 1920,
    "height_px": 1080
  },
  "source_refs": [
    "synthetic_source_a"
  ],
  "primitives": [
    {
      "id": "title",
      "kind": "text",
      "bounds": {
        "x": 64,
        "y": 80,
        "w": 1792,
        "h": 100
      },
      "style": {
        "color_token": "palette.text",
        "typography_token": "typography.heading"
      },
      "text": {
        "content": "Quarter Timeline",
        "role": "heading"
      },
      "slot_id": "title"
    },
    {
      "id": "timeline_axis",
      "kind": "line",
      "bounds": {
        "x": 88,
        "y": 260,
        "w": 1,
        "h": 384
      },
      "style": {
        "stroke_token": "palette.primary",
        "stroke_width_px": 2
      },
      "line": {
        "stroke_style": "solid"
      }
    },
    {
      "id": "timeline_marker_01",
      "kind": "shape",
      "bounds": {
        "x": 80,
        "y": 300,
        "w": 16,
        "h": 16
      },
      "style": {
        "fill_token": "palette.primary",
        "stroke_token": "palette.primary",
        "stroke_width_px": 2
      },
      "shape": {
        "shape_kind": "ellipse"
      }
    },
    {
      "id": "timeline_item_01",
      "kind": "text",
      "bounds": {
        "x": 112,
        "y": 260,
        "w": 1744,
        "h": 96
      },
      "style": {
        "color_token": "palette.text",
        "typography_token": "typography.body"
      },
      "text": {
        "content": "Placeholder milestone one",
        "role": "body"
      },
      "slot_id": "timeline_items"
    },
    {
      "id": "timeline_marker_02",
      "kind": "shape",
      "bounds": {
        "x": 80,
        "y": 396,
        "w": 16,
        "h": 16
      },
      "style": {
        "fill_token": "palette.primary",
        "stroke_token": "palette.primary",
        "stroke_width_px": 2
      },
      "shape": {
        "shape_kind": "ellipse"
      }
    },
    {
      "id": "timeline_item_02",
      "kind": "text",
      "bounds": {
        "x": 112,
        "y": 356,
        "w": 1744,
        "h": 96
      },
      "style": {
        "color_token": "palette.text",
        "typography_token": "typography.body"
      },
      "text": {
        "content": "Placeholder milestone two",
        "role": "body"
      },
      "slot_id": "timeline_items"
    },
    {
      "id": "timeline_marker_03",
      "kind": "shape",
      "bounds": {
        "x": 80,
        "y": 492,
        "w": 16,
        "h": 16
      },
      "style": {
        "fill_token": "palette.primary",
        "stroke_token": "palette.primary",
        "stroke_width_px": 2
      },
      "shape": {
        "shape_kind": "ellipse"
      }
    },
    {
      "id": "timeline_item_03",
      "kind": "text",
      "bounds": {
        "x": 112,
        "y": 452,
        "w": 1744,
        "h": 96
      },
      "style": {
        "color_token": "palette.text",
        "typography_token": "typography.body"
      },
      "text": {
        "content": "Placeholder milestone three",
        "role": "body"
      },
      "slot_id": "timeline_items"
    },
    {
      "id": "timeline_marker_04",
      "kind": "shape",
      "bounds": {
        "x": 80,
        "y": 588,
        "w": 16,
        "h": 16
      },
      "style": {
        "fill_token": "palette.primary",
        "stroke_token": "palette.primary",
        "stroke_width_px": 2
      },
      "shape": {
        "shape_kind": "ellipse"
      }
    },
    {
      "id": "timeline_item_04",
      "kind": "text",
      "bounds": {
        "x": 112,
        "y": 548,
        "w": 1744,
        "h": 96
      },
      "style": {
        "color_token": "palette.text",
        "typography_token": "typography.body"
      },
      "text": {
        "content": "Placeholder milestone four",
        "role": "body"
      },
      "slot_id": "timeline_items"
    }
  ]
}
