{
  "index": 8,
  "layout": "conclusion",
  "canvas": {
    "width_px": 1920,
    "height_px": 1080
  },
  "source_refs": [
    "synthetic_source_p",
    "synthetic_source_q"
  ],
  "primitives": [
    {
      "id": "title",
      "kind": "text",
      "bounds": {
        "x": 64,
        "y": 80,
        "w": 1792,
        "h": 100
      },
      "style": {
        "color_token": "palette.text",
        "typography_token": "typography.heading"
      },
      "text": {
        "content": "Next Steps",
        "role": "heading"
      },
      "slot_id": "title"
    },
    {
      "id": "summary",
      "kind": "text",
      "bounds": {
        "x": 64,
        "y": 210,
        "w": 1792,
        "h": 160
      },
      "style": {
        "color_token": "palette.text",
        "typography_token": "typography.body"
      },
      "text": {
        "content": "Two synthetic asks close the brief.",
        "role": "body"
      },
      "slot_id": "summary"
    },
    {
      "id": "call_to_action_01",
      "kind": "text",
      "bounds": {
        "x": 64,
        "y": 400,
        "w": 1792,
        "h": 96
      },
      "style": {
        "color_token": "palette.text",
        "typography_token": "typography.body"
      },
      "text": {
        "content": "\u2022 Approve placeholder scope",
        "role": "body"
      },
      "slot_id": "call_to_action"
    },
    {
      "id": "call_to_action_02",
      "kind": "text",
      "bounds": {
        "x": 64,
        "y": 496,
        "w": 1792,
        "h": 96
      },
      "style": {
        "color_token": "palette.text",
        "typography_token": "typography.body"
      },
      "text": {
        "content": "\u2022 Approve placeholder timeline",
        "role": "body"
      },
      "slot_id": "call_to_action"
    }
  ]
}
