{
  "index": 6,
  "layout": "timeline",
  "canvas": {
    "width_px": 1920,
    "height_px": 1080
  },
  "source_refs": [
    "synthetic_source_p"
  ],
  "primitives": [
    {
      "id": "title",
      "kind": "text",
      "bounds": {
        "x": 64,
        "y": 80,
        "w": 1792,
        "h": 100
      },
      "style": {
        "color_token": "palette.text",
        "typography_token": "typography.heading"
      },
      "text": {
        "content": "Rollout Plan",
        "role": "heading"
      },
      "slot_id": "title"
    },
    {
      "id": "timeline_item_01",
      "kind": "text",
      "bounds": {
        "x": 64,
        "y": 260,
        "w": 1792,
        "h": 233
      },
      "style": {
        "color_token": "palette.text",
        "typography_token": "typography.body"
      },
      "text": {
        "content": "\u2022 Milestone A \u2014 placeholder",
        "role": "body"
      },
      "slot_id": "timeline_items"
    },
    {
      "id": "timeline_item_02",
      "kind": "text",
      "bounds": {
        "x": 64,
        "y": 493,
        "w": 1792,
        "h": 233
      },
      "style": {
        "color_token": "palette.text",
        "typography_token": "typography.body"
      },
      "text": {
        "content": "\u2022 Milestone B \u2014 placeholder",
        "role": "body"
      },
      "slot_id": "timeline_items"
    },
    {
      "id": "timeline_item_03",
      "kind": "text",
      "bounds": {
        "x": 64,
        "y": 726,
        "w": 1792,
        "h": 233
      },
      "style": {
        "color_token": "palette.text",
        "typography_token": "typography.body"
      },
      "text": {
        "content": "\u2022 Milestone C \u2014 placeholder",
        "role": "body"
      },
      "slot_id": "timeline_items"
    }
  ]
}
